{
  "schema_version": "0.1.0",
  "runtime_id": "RUN-DU-001-EP-R1",
  "runtime_revision": 2,
  "runtime_status": "active",
  "updated_at": "2026-08-03T22:11:14+09:00",
  "delivery_unit_id": "DU-001",
  "execution_plan_ref": {
    "path": "delivery-units/DU-001/execution-plan/R1.json",
    "execution_plan_id": "EP-DU-001",
    "execution_plan_revision": 1,
    "canonical_sha256": "3b150081ec0fab218dd8eebc748653bf92df222a7647bf1dd0c3243c11018640"
  },
  "sources": [
    {
      "id": "SRC-RUN-001",
      "type": "approved_artifact",
      "captured_at": "2026-08-03T22:05:52+09:00",
      "locator": "delivery-units/DU-001/execution-plan/R1.json#EP-DU-001@R1",
      "content_ko": "제품 책임자가 승인한 DU-001 실행 계획 R1이며 현재 실행 범위의 committed 작업 4개와 담당 실행자를 고정합니다."
    },
    {
      "id": "SRC-RUN-002",
      "type": "user_statement",
      "captured_at": "2026-08-03T22:05:52+09:00",
      "locator": "conversation:2026-08-03:du-001-runtime-start",
      "content_ko": "제품 책임자가 승인 실행 계획의 실제 착수를 명시적으로 요청했습니다."
    }
  ],
  "work_runs": [
    {
      "work_item_ref": "WORK:purchase-request-screen-spec@R1",
      "executor_ref": "EXEC:design-owner",
      "status": "not_started",
      "started_at": null,
      "completed_at": null,
      "transition_log": [
        {
          "id": "TR-001",
          "from": null,
          "to": "not_started",
          "occurred_at": "2026-08-03T22:05:52+09:00",
          "actor_ref": "EXEC:ai-coordinator",
          "source_ref": "SRC-RUN-001",
          "note_ko": "승인 계획의 화면 기준 확정 작업을 런타임 추적 대상으로 초기화했습니다."
        }
      ],
      "blockers": [],
      "evidence_instances": []
    },
    {
      "work_item_ref": "WORK:purchase-request-contract-fixtures@R1",
      "executor_ref": "EXEC:ai-technical-design",
      "status": "in_progress",
      "started_at": "2026-08-03T22:11:14+09:00",
      "completed_at": null,
      "transition_log": [
        {
          "id": "TR-002",
          "from": null,
          "to": "not_started",
          "occurred_at": "2026-08-03T22:05:52+09:00",
          "actor_ref": "EXEC:ai-coordinator",
          "source_ref": "SRC-RUN-001",
          "note_ko": "승인 계획의 계약 예제·검증 기준선 작업을 런타임 추적 대상으로 초기화했습니다."
        },
        {
          "id": "TR-005",
          "from": "not_started",
          "to": "in_progress",
          "occurred_at": "2026-08-03T22:11:14+09:00",
          "actor_ref": "EXEC:ai-coordinator",
          "source_ref": "SRC-RUN-002",
          "note_ko": "격리된 contract-fixtures worktree에서 기술 설계 AI 작업을 시작하도록 위임했습니다."
        }
      ],
      "blockers": [],
      "evidence_instances": []
    },
    {
      "work_item_ref": "WORK:identity-organization-context@R1",
      "executor_ref": "EXEC:ai-security-platform",
      "status": "in_progress",
      "started_at": "2026-08-03T22:11:14+09:00",
      "completed_at": null,
      "transition_log": [
        {
          "id": "TR-003",
          "from": null,
          "to": "not_started",
          "occurred_at": "2026-08-03T22:05:52+09:00",
          "actor_ref": "EXEC:ai-coordinator",
          "source_ref": "SRC-RUN-001",
          "note_ko": "승인 계획의 인증·조직 컨텍스트 작업을 런타임 추적 대상으로 초기화했습니다."
        },
        {
          "id": "TR-006",
          "from": "not_started",
          "to": "in_progress",
          "occurred_at": "2026-08-03T22:11:14+09:00",
          "actor_ref": "EXEC:ai-coordinator",
          "source_ref": "SRC-RUN-002",
          "note_ko": "격리된 identity-context worktree에서 보안·플랫폼 AI 작업을 시작하도록 위임했습니다."
        }
      ],
      "blockers": [],
      "evidence_instances": []
    },
    {
      "work_item_ref": "WORK:purchase-request-data-schema@R1",
      "executor_ref": "EXEC:ai-backend",
      "status": "in_progress",
      "started_at": "2026-08-03T22:11:14+09:00",
      "completed_at": null,
      "transition_log": [
        {
          "id": "TR-004",
          "from": null,
          "to": "not_started",
          "occurred_at": "2026-08-03T22:05:52+09:00",
          "actor_ref": "EXEC:ai-coordinator",
          "source_ref": "SRC-RUN-001",
          "note_ko": "승인 계획의 구매 요청 데이터 구조·마이그레이션 작업을 런타임 추적 대상으로 초기화했습니다."
        },
        {
          "id": "TR-007",
          "from": "not_started",
          "to": "in_progress",
          "occurred_at": "2026-08-03T22:11:14+09:00",
          "actor_ref": "EXEC:ai-coordinator",
          "source_ref": "SRC-RUN-002",
          "note_ko": "격리된 data-schema worktree에서 백엔드 AI 작업을 시작하도록 위임했습니다."
        }
      ],
      "blockers": [],
      "evidence_instances": []
    }
  ]
}
